### ISSUE TITLE
Connection is slow but queries are fast?

### ISSUE THREAD

**Issue by ryanmortier** [Adldap2/Adldap2#408]
- Adldap2 Version: Latest
- LDAP Type: Active Directory
- PHP Version: 7.1

### Description:
Whether I use `auto_connect` `true` or `false`, connecting to Active Directory takes about 3-4 seconds. After I have a connection, queries are pretty much instant. Is this normal behaviour or should my connection be faster?

**Comment by stevebauman** [comment]
Connections should be much faster. My connection and queries are pretty much instant.

This sounds like it's either a network or application issue.

Are you able to debug further and find out?

Running Wireshark on your domain controller and inspecting the authentication request would help you in this scenario.

**Comment by ryanmortier** [comment]
Interesting...

Take a look below. I'm developing on a Macbook just FYI.

As soon as I trigger the `Adldap::connect()` the first packet starts. It appears as if MDNS is the issue? Though I'm not sure why it's using DNS as I have my domain controllers in my config as the IP address and not the DNS names?

Anyway, as soon as the 5th packet shows, I get my connection immediately. The time between the 1st packet doing MDNS and the 5th packet actually initiating the connection is the time delay that I'm experiencing.

I guess I'm going to do some Googling here but in the mean time, have you experienced this at all or have any ideas?

| No.   | Time       | Source          | Destination     | Protocol | Length | Info                                                                                                                                                                                                               |
|-------|------------|-----------------|-----------------|----------|--------|--------------------------------------------------------------------------------------------------------------------------------------------------------------------------------------------------------------------|
| 55180 | 327.733858 | 192.168.2.108   | 224.0.0.251     | MDNS     | 83     | Standard query 0x0000 A Ryans-MacBook-Pro.local, "QU" question                                                                                                                                                     |
| 55181 | 327.918904 | 192.168.2.108   | 224.0.0.251     | MDNS     | 112    | Standard query 0x0000 SRV HP Color LaserJet M452dw (B36949)._privet._tcp.local, "QU" question                                                                                                                      |
| 55195 | 328.735728 | 192.168.2.108   | 224.0.0.251     | MDNS     | 83     | Standard query 0x0000 A Ryans-MacBook-Pro.local, "QM" question                                                                                                                                                     |
| 55225 | 331.742385 | 192.168.2.108   | 224.0.0.251     | MDNS     | 83     | Standard query 0x0000 A Ryans-MacBook-Pro.local, "QM" question                                                                                                                                                     |
| 55235 | 332.726568 | 192.168.2.108   | 192.168.2.5     | TCP      | 78     | 49860  >  389 [SYN] Seq=0 Win=65535 Len=0 MSS=1460 WS=32 TSval=371626102 TSecr=0 SACK_PERM=1                                                                                                                       |
| 55236 | 332.726639 | 192.168.2.5     | 192.168.2.108   | TCP      | 74     | 389  >  49860 [SYN, ACK] Seq=0 Ack=1 Win=8192 Len=0 MSS=1460 WS=256 SACK_PERM=1 TSval=2494847497 TSecr=371626102                                                                                                   |
| 55237 | 332.726986 | 192.168.2.108   | 192.168.2.5     | TCP      | 66     | 49860  >  389 [ACK] Seq=1 Ack=1 Win=131744 Len=0 TSval=371626102 TSecr=2494847497                                                                                                                                  |
| 55238 | 332.727052 | 192.168.2.108   | 192.168.2.5     | LDAP     | 96     | bindRequest(1) "ldap" simple                                                                                                                                                                                       |
| 55239 | 332.728994 | 192.168.2.5     | 192.168.2.108   | LDAP     | 88     | bindResponse(1) success                                                                                                                                                                                            |
| 55240 | 332.729333 | 192.168.2.108   | 192.168.2.5     | TCP      | 66     | 49860  >  389 [ACK] Seq=31 Ack=23 Win=131744 Len=0 TSval=371626104 TSecr=2494847497                                                                                                                                |
| 55241 | 332.735227 | 192.168.2.108   | 192.168.2.5     | LDAP     | 347    | searchRequest(2) "dc=corp,dc=[redacted],dc=com" wholeSubtree                                                                                                                                                       |
| 55242 | 332.735925 | 192.168.2.5     | 192.168.2.108   | LDAP     | 1105   | searchResEntry(2) "CN=[redacted],OU=No GPO,OU=Head Office,OU=Corporate Structure,DC=corp,DC=[redacted],DC=com"  | searchResRef(2)  | searchResRef(2)  | searchResRef(2)  | searchResDone(2) success  [1 result]    |
| 55243 | 332.736318 | 192.168.2.108   | 192.168.2.5     | TCP      | 66     | 49860  >  389 [ACK] Seq=312 Ack=1062 Win=130688 Len=0 TSval=371626110 TSecr=2494847505                                                                                                                             |
| 55244 | 332.761818 | 192.168.2.108   | 192.168.2.5     | LDAP     | 73     | unbindRequest(3)                                                                                                                                                                                                   |
| 55245 | 332.761820 | 192.168.2.108   | 192.168.2.5     | TCP      | 66     | 49860  >  389 [FIN, ACK] Seq=319 Ack=1062 Win=131072 Len=0 TSval=371626134 TSecr=2494847505                                                                                                                        |
| 55246 | 332.761881 | 192.168.2.5     | 192.168.2.108   | TCP      | 66     | 389  >  49860 [ACK] Seq=1062 Ack=320 Win=532480 Len=0 TSval=2494847532 TSecr=371626134                                                                                                                             |
| 55247 | 332.762075 | 192.168.2.5     | 192.168.2.108   | TCP      | 54     | 389  >  49860 [RST, ACK] Seq=1062 Ack=320 Win=0 Len=0                                                                                                                                                              |

**Comment by ryanmortier** [comment]
I believe I'm on to something here: https://support.microsoft.com/en-us/help/2439492/adperf-ldap-connects-take-longer-when-targeting-fully-qualified-dns-hostnames

When I manually do `ldap_connect('ldap://[domain controller ip address]:389');` I still get the delay.

**Comment by ryanmortier** [comment]
I posted a Stack Overflow question here: https://stackoverflow.com/questions/44760633/mac-os-x-slow-connections-mdns-4-5-seconds-bonjour-slow

**Comment by stevebauman** [comment]
Thanks for the detailed updates @ryanmortier! Appreciate it.

I've up-voted your question, I'm definitely curious as to what could be causing this too.

**Comment by ryanmortier** [comment]
No problem. I think I finally solved my issue. See my `edit2` and `edit3` on Stack Overflow.

Closing this issue, thanks for letting me keep it open while I troubleshooted the problem.

**Comment by stevebauman** [comment]
Wow what a strange issue, thanks for posting your solution! I'm sure there will be people in the future needing it.

Also, no problem for keeping it open. If you encounter any other issues, please let me know :)
