### ISSUE TITLE
Slow authentication resolution

### ISSUE THREAD

**Issue by newtekDev** [Adldap2/Adldap2#511]
- Adldap2 Version: 3.0
- LDAP Type: Active Directory
- PHP Version: 7.2

### Description:
I have two applications both using LDAP for authentication. One is a homespun ldap connection object. When I authenticate using that system the connection is incredibly fast. 

The other is a Laravel aplication using this library and it takes about 5 or so seconds to connect. Why is there a difference. I am sure its something I am doing wrong and not Adldap. I am not well versed in LDAP.

How can I debug this issue?

Not sure if it would help, but here is my adldap config files:

adldap_auth.php:
```php
return [
    'connection' => env('ADLDAP_CONNECTION', 'default'),
    'provider' => Adldap\Laravel\Auth\DatabaseUserProvider::class,
    'resolver' => Adldap\Laravel\Auth\Resolver::class,
    'importer' => Adldap\Laravel\Auth\Importer::class,
    'rules' => [
        // Denys deleted users from authenticating.
        Adldap\Laravel\Validation\Rules\DenyTrashed::class,
        // Allows only manually imported users to authenticate.
        // Adldap\Laravel\Validation\Rules\OnlyImported::class,
    ],
    'scopes' => [
        // Only allows users with a user principal name to authenticate
        Adldap\Laravel\Scopes\UpnScope::class,
    ],
    'usernames' => [
        'ldap' => 'samaccountname',
        'eloquent' => 'username',
    ],
    'login_fallback' => env('ADLDAP_LOGIN_FALLBACK', true),
    'password_sync' => env('ADLDAP_PASSWORD_SYNC', true),
    'windows_auth_attribute' => ['samaccountname' => 'AUTH_USER'],
    'sync_attributes' => [
        'username' => 'samaccountname',
        'first_name' => 'cn',
    ],
];
``` 

adldap.php
```php
return [
    'connections' => [
        'default' => [
            'auto_connect' => true,
            'connection' => Adldap\Connections\Ldap::class,
            'schema' => Adldap\Schemas\ActiveDirectory::class,
            'connection_settings' => [
                'account_prefix' => env('ADLDAP_ACCOUNT_PREFIX', ''),
                'account_suffix' => env('ADLDAP_ACCOUNT_SUFFIX', ''),
                'domain_controllers' => explode(' ', env('ADLDAP_CONTROLLERS', 'corp-dc1.corp.acme.org corp-dc2.corp.acme.org')),
                'port' => env('ADLDAP_PORT', 389),
                'timeout' => env('ADLDAP_TIMEOUT', 5),
                'base_dn' => env('ADLDAP_BASEDN', 'dc=corp,dc=acme,dc=org'),
                'admin_account_suffix' => env('ADLDAP_ADMIN_ACCOUNT_SUFFIX', ''),
                'admin_username' => env('ADLDAP_ADMIN_USERNAME', 'username'),
                'admin_password' => env('ADLDAP_ADMIN_PASSWORD', 'password'),
                'follow_referrals' => false,
                'use_ssl' => false,
                'use_tls' => false,
            ],
        ],
    ],
];
```

**Comment by wranger** [comment]
At first you need to find out what is slow, the server, the network or the application. Tcpdump or windump is your friend:

run: On your webserver where the application is running.
<code>
tcpdump -i any -np port 80 or port 443 or port 389 or port 636 -A -s0 
</code>

This will show you the incoming browser request, the ldap connection, the ldap reply and the server to browser response.

**Comment by newtekDev** [comment]
Right now I am using my local, when  ran that command I am getting endless:
![screen shot 2018-02-22 at 12 09 14 pm](https://user-images.githubusercontent.com/28765242/36553051-5a822380-17c9-11e8-9a2b-34ba907e84bb.png)

**Comment by stevebauman** [comment]
> The other is a Laravel aplication using this library and it takes about 5 or so seconds to connect.

Sounds like you're hitting your configured timeout period of `5` seconds. Are you sure you're able to connect to your server?

**Comment by wranger** [comment]
maybe you should try this:

<code>
tcpdump -i any -nnp port 389 or port 636

</code>

**Comment by newtekDev** [comment]
By the way, thanks for the quick responses! It does resolve eventually, but it just takes a while. So I think I am connecting.

As it happens, I just tried the code on a remote server and it worked really quickly, so its not as important.

Some information I forgot regarding local:
- OS: macOS High Sierra 10.13.3
- using Homestead Laravel for local server

When I ran the second command you gave me I got this when I ran the authentication, not really sure what any of that means:
```
12:20:38.547008 IP 172.21.1.127.57998 > 208.106.205.153.389: Flags [SEW], seq 3481597888, win 65535, options [mss 1452,nop,wscale 5,nop,nop,TS val 898465913 ecr 0,sackOK,eol], length 0
12:20:39.553857 IP 172.21.1.127.57998 > 208.106.205.153.389: Flags [S], seq 3481597888, win 65535, options [mss 1452,nop,wscale 5,nop,nop,TS val 898466913 ecr 0,sackOK,eol], length 0
12:20:40.558055 IP 172.21.1.127.57998 > 208.106.205.153.389: Flags [S], seq 3481597888, win 65535, options [mss 1452,nop,wscale 5,nop,nop,TS val 898467913 ecr 0,sackOK,eol], length 0
12:20:41.560390 IP 172.21.1.127.57998 > 208.106.205.153.389: Flags [S], seq 3481597888, win 65535, options [mss 1452,nop,wscale 5,nop,nop,TS val 898468913 ecr 0,sackOK,eol], length 0
12:20:42.563747 IP 172.21.1.127.57998 > 208.106.205.153.389: Flags [S], seq 3481597888, win 65535, options [mss 1452,nop,wscale 5,nop,nop,TS val 898469913 ecr 0,sackOK,eol], length 0
12:20:43.549978 IP 172.21.1.127.58019 > 10.0.20.14.389: Flags [SEW], seq 563842017, win 65535, options [mss 1452,nop,wscale 5,nop,nop,TS val 898470887 ecr 0,sackOK,eol], length 0
12:20:43.575989 IP 172.21.1.127.57998 > 208.106.205.153.389: Flags [S], seq 3481597888, win 65535, options [mss 1452,nop,wscale 5,nop,nop,TS val 898470913 ecr 0,sackOK,eol], length 0
12:20:44.557864 IP 172.21.1.127.58019 > 10.0.20.14.389: Flags [S], seq 563842017, win 65535, options [mss 1452,nop,wscale 5,nop,nop,TS val 898471888 ecr 0,sackOK,eol], length 0
12:20:45.566061 IP 172.21.1.127.58019 > 10.0.20.14.389: Flags [S], seq 563842017, win 65535, options [mss 1452,nop,wscale 5,nop,nop,TS val 898472888 ecr 0,sackOK,eol], length 0
12:20:45.591199 IP 172.21.1.127.57998 > 208.106.205.153.389: Flags [S], seq 3481597888, win 65535, options [mss 1452,nop,wscale 5,nop,nop,TS val 898472913 ecr 0,sackOK,eol], length 0
12:20:46.570377 IP 172.21.1.127.58019 > 10.0.20.14.389: Flags [S], seq 563842017, win 65535, options [mss 1452,nop,wscale 5,nop,nop,TS val 898473888 ecr 0,sackOK,eol], length 0
12:20:47.572793 IP 172.21.1.127.58019 > 10.0.20.14.389: Flags [S], seq 563842017, win 65535, options [mss 1452,nop,wscale 5,nop,nop,TS val 898474888 ecr 0,sackOK,eol], length 0
12:20:48.553721 IP 172.21.1.127.58040 > 172.16.1.95.389: Flags [SEW], seq 3675554623, win 65535, options [mss 1452,nop,wscale 5,nop,nop,TS val 898475867 ecr 0,sackOK,eol], length 0
12:20:48.575115 IP 172.21.1.127.58019 > 10.0.20.14.389: Flags [S], seq 563842017, win 65535, options [mss 1452,nop,wscale 5,nop,nop,TS val 898475888 ecr 0,sackOK,eol], length 0
12:20:48.658647 IP 172.16.1.95.389 > 172.21.1.127.58040: Flags [S.E], seq 574213357, ack 3675554624, win 8192, options [mss 1452,nop,wscale 8,sackOK,TS val 5448679 ecr 898475867], length 0
12:20:48.658678 IP 172.21.1.127.58040 > 172.16.1.95.389: Flags [.], ack 1, win 4140, options [nop,nop,TS val 898475969 ecr 5448679], length 0
12:20:48.659301 IP 172.21.1.127.58040 > 172.16.1.95.389: Flags [P.], seq 1:70, ack 1, win 4140, options [nop,nop,TS val 898475969 ecr 5448679], length 69
12:20:48.858729 IP 172.16.1.95.389 > 172.21.1.127.58040: Flags [P.], seq 1:23, ack 70, win 258, options [nop,nop,TS val 5448699 ecr 898475969], length 22
12:20:48.858750 IP 172.21.1.127.58040 > 172.16.1.95.389: Flags [.], ack 23, win 4139, options [nop,nop,TS val 898476165 ecr 5448699], length 0
12:20:48.870828 IP 172.21.1.127.58040 > 172.16.1.95.389: Flags [P.], seq 70:207, ack 23, win 4139, options [nop,nop,TS val 898476177 ecr 5448699], length 137
12:20:49.042496 IP 172.16.1.95.389 > 172.21.1.127.58040: Flags [.], seq 23:1463, ack 207, win 258, options [nop,nop,TS val 5448718 ecr 898476177], length 1440
12:20:49.043081 IP 172.16.1.95.389 > 172.21.1.127.58040: Flags [.], seq 1463:2903, ack 207, win 258, options [nop,nop,TS val 5448718 ecr 898476177], length 1440
12:20:49.043094 IP 172.21.1.127.58040 > 172.16.1.95.389: Flags [.], ack 2903, win 4051, options [nop,nop,TS val 898476345 ecr 5448718], length 0
12:20:49.043286 IP 172.16.1.95.389 > 172.21.1.127.58040: Flags [.], seq 2903:4343, ack 207, win 258, options [nop,nop,TS val 5448718 ecr 898476177], length 1440
12:20:49.043313 IP 172.21.1.127.58040 > 172.16.1.95.389: Flags [.], ack 4343, win 4096, options [nop,nop,TS val 898476346 ecr 5448718], length 0
12:20:49.104967 IP 172.16.1.95.389 > 172.21.1.127.58040: Flags [.], seq 4343:5783, ack 207, win 258, options [nop,nop,TS val 5448718 ecr 898476177], length 1440
12:20:49.166962 IP 172.16.1.95.389 > 172.21.1.127.58040: Flags [P.], seq 5783:6080, ack 207, win 258, options [nop,nop,TS val 5448728 ecr 898476345], length 297
12:20:49.166980 IP 172.21.1.127.58040 > 172.16.1.95.389: Flags [.], ack 6080, win 4086, options [nop,nop,TS val 898476466 ecr 5448718], length 0
12:20:49.229604 IP 172.21.1.127.58040 > 172.16.1.95.389: Flags [P.], seq 207:247, ack 6080, win 4096, options [nop,nop,TS val 898476528 ecr 5448718], length 40
12:20:49.354990 IP 172.16.1.95.389 > 172.21.1.127.58040: Flags [P.], seq 6080:6102, ack 247, win 258, options [nop,nop,TS val 5448749 ecr 898476528], length 22
12:20:49.355012 IP 172.21.1.127.58040 > 172.16.1.95.389: Flags [.], ack 6102, win 4095, options [nop,nop,TS val 898476652 ecr 5448749], length 0
12:20:49.355685 IP 172.21.1.127.58040 > 172.16.1.95.389: Flags [P.], seq 247:316, ack 6102, win 4096, options [nop,nop,TS val 898476652 ecr 5448749], length 69
12:20:49.550615 IP 172.16.1.95.389 > 172.21.1.127.58040: Flags [P.], seq 6102:6124, ack 316, win 257, options [nop,nop,TS val 5448768 ecr 898476652], length 22
12:20:49.550648 IP 172.21.1.127.58040 > 172.16.1.95.389: Flags [.], ack 6124, win 4095, options [nop,nop,TS val 898476845 ecr 5448768], length 0
12:20:49.618505 IP 172.21.1.127.57998 > 208.106.205.153.389: Flags [S], seq 3481597888, win 65535, options [mss 1452,nop,wscale 5,nop,nop,TS val 898476913 ecr 0,sackOK,eol], length 0
12:20:49.655182 IP 172.21.1.127.58040 > 172.16.1.95.389: Flags [P.], seq 316:323, ack 6124, win 4096, options [nop,nop,TS val 898476949 ecr 5448768], length 7
12:20:49.655410 IP 172.21.1.127.58040 > 172.16.1.95.389: Flags [F.], seq 323, ack 6124, win 4096, options [nop,nop,TS val 898476949 ecr 5448768], length 0
12:20:49.862990 IP 172.16.1.95.389 > 172.21.1.127.58040: Flags [R.], seq 6124, ack 324, win 0, length 0
12:20:50.600989 IP 172.21.1.127.58019 > 10.0.20.14.389: Flags [S], seq 563842017, win 65535, options [mss 1452,nop,wscale 5,nop,nop,TS val 898477889 ecr 0,sackOK,eol], length 0
12:20:54.616149 IP 172.21.1.127.58019 > 10.0.20.14.389: Flags [S], seq 563842017, win 65535, options [mss 1452,nop,wscale 5,nop,nop,TS val 898481889 ecr 0,sackOK,eol], length 0
12:20:57.652833 IP 172.21.1.127.57998 > 208.106.205.153.389: Flags [S], seq 3481597888, win 65535, options [mss 1452,nop,wscale 5,nop,nop,TS val 898484913 ecr 0,sackOK,eol], length 0
12:21:02.639421 IP 172.21.1.127.58019 > 10.0.20.14.389: Flags [S], seq 563842017, win 65535, options [mss 1452,nop,wscale 5,nop,nop,TS val 898489889 ecr 0,sackOK,eol], length 0
12:21:13.698397 IP 172.21.1.127.57998 > 208.106.205.153.389: Flags [S], seq 3481597888, win 65535, options [mss 1452,nop,wscale 5,nop,nop,TS val 898500913 ecr 0,sackOK,eol], length 0
12:21:18.686834 IP 172.21.1.127.58019 > 10.0.20.14.389: Flags [S], seq 563842017, win 65535, options [mss 1452,nop,wscale 5,nop,nop,TS val 898505889 ecr 0,sackOK,eol], length 0
12:21:45.787367 IP 172.21.1.127.57998 > 208.106.205.153.389: Flags [S], seq 3481597888, win 65535, options [mss 1452,sackOK,eol], length 0
12:21:50.770282 IP 172.21.1.127.58019 > 10.0.20.14.389: Flags [S], seq 563842017, win 65535, options [mss 1452,sackOK,eol], length 0
```

**Comment by wranger** [comment]
No there is no response

Thats the syn-Packet of the three way TCP handshake,

<code>
12:20:39.553857 IP 172.21.1.127.57998 > 208.106.205.153.389: Flags [S], seq 3481597888, win 65535, options [mss 1452,nop,wscale 5,nop,nop,TS val 898466913 ecr 0,sackOK,eol], length 0
<code>

if there would be a response the IP direction would change

**Comment by newtekDev** [comment]
Oh, so the login fallback is kicking in

**Comment by newtekDev** [comment]
But I can import users from the ldap library, why is that different

**Comment by stevebauman** [comment]
So your Laravel application is running locally on your computer while your other application using custom LDAP auth is on a remote server?

Are you going through a VPN or anything to be able to connect to your LDAP server with your local Laravel application?

**Comment by newtekDev** [comment]
Well I have used both applications on local and remote. The homespun works the same no matter, but apparently the Laravel is slow only on local.

Everything is done through VPN or internal server, with the same result in either.

**Comment by stevebauman** [comment]
Hmmm, this may be difficult to debug... Can you try upgrading to Adldap2-Laravel `v4` and see if you still encounter this issue?

**Comment by stevebauman** [comment]
Closing due to inactivity.

**Comment by donaldallen** [comment]
@newtekDev Did you ever figure out what caused your issue? I'm having the same issue.

**Comment by pbgneff** [comment]
Sorry, no, I never really looked further, I think this is an issue relating to my local networking setup.
